<!ELEMENT email (de,para+,asunto*,adxunto*)>
<!ELEMENT de (#PCDATA)>
<!ELEMENT para (#PCDATA)>
<!ELEMENT asunto (#PCDATA)>
<!ELEMENT adxunto (#PCDATA)>